{
  "schema_version": "7.0",
  "evidence_id": "dddddddd-dddd-4ddd-8ddd-dddddddddddd",
  "observation_id": "33333333-3333-4333-8333-333333333333",
  "evidence_type": "frame",
  "captured_at": "2026-10-01T10:00:02Z",
  "source_frame_id": "entrance-camera:2416",
  "source_bbox_normalized": null,
  "content_type": "image/jpeg",
  "width": 1920,
  "height": 1080,
  "size_bytes": 182400,
  "sha256": "sha256:aaaaaaaaaaaaaaaaaaaaaaaaaaaaaaaaaaaaaaaaaaaaaaaaaaaaaaaaaaaaaaaa"
}
